{
  "benchmarkVersion": "2.1",
  "benchmarkId": "B01",
  "taxonomy": "Close-up Front",
  "branch": "control",
  "baseFrameSha256": "0000000000000000000000000000000000000000000000000000000000000000",
  "a2Sha256": "1e0c9720087d4bab4b1ab5d65d31827aba99cf4c696c1a72570ed4114dca2c5d",
  "faceQcBefore": 84.6,
  "faceQcAfter": 84.6,
  "identityScore": 84.6,
  "eyesBrowsScore": 84.0,
  "geometryScore": 92.0,
  "anatomyScore": 90.0,
  "outfitScore": 90.0,
  "environmentScore": 90.0,
  "globalScore": 88.0,
  "pixelPreservationResult": "PASS",
  "runtimeMs": 0,
  "retryCount": 0,
  "workflowId": null,
  "workflowSha256": null,
  "seed": 42,
  "gpuName": null,
  "vramPeakMb": null,
  "restorerId": "control",
  "caseId": "B01",
  "faceScore": 84.6,
  "pixelLockPassed": true,
  "samples": 3,
  "notes": "Contract fixture only; not benchmark evidence."
}
