{
  "benchmarkVersion": "2.1",
  "benchmarkId": "B04",
  "taxonomy": "Running Front 3/4",
  "branch": "nano-banana-edit",
  "baseFrameSha256": "bb031e7adfcc0c7d79544c3edb932eebafc1f797a59881415e57addc584d26a0",
  "a2Sha256": "1e0c9720087d4bab4b1ab5d65d31827aba99cf4c696c1a72570ed4114dca2c5d",
  "faceQcBefore": 84.6,
  "faceQcAfter": 88.1,
  "identityScore": 88.1,
  "eyesBrowsScore": 87.0,
  "geometryScore": 92.0,
  "anatomyScore": 90.0,
  "outfitScore": 90.0,
  "environmentScore": 90.0,
  "globalScore": 89.0,
  "pixelPreservationResult": "PASS",
  "runtimeMs": 1000,
  "retryCount": 0,
  "workflowId": null,
  "workflowSha256": null,
  "seed": 42,
  "gpuName": null,
  "vramPeakMb": null,
  "restorerId": "nano-banana-edit",
  "caseId": "B04",
  "faceScore": 88.1,
  "pixelLockPassed": true,
  "samples": 3,
  "notes": "Contract fixture only; not benchmark evidence."
}
